{
  "entry_id": "led-0002",
  "seq": {
    "stream_id": "ledger-main-0001",
    "seq": 2
  },
  "timestamp": "2026-09-25T13:34:09.066Z",
  "origin": {
    "kind": "agent",
    "id": "codex",
    "provider": "codex",
    "display_name": "Codex"
  },
  "category": "mutation",
  "summary": "Baked cloth onto 16 Mask_* bones for Walk_Swagger.",
  "evidence": [
    {
      "type": "job",
      "job_id": "fixture-exec-python-0001",
      "operation": "execute_python",
      "state": "completed",
      "device_digest": "eeeeeeeeeeeeeeeeeeeeeeeeeeeeeeeeeeeeeeeeeeeeeeeeeeeeeeeeeeeeeeee",
      "relay_digest": "dddddddddddddddddddddddddddddddddddddddddddddddddddddddddddddddd",
      "started_at": "2026-09-25T13:34:09.059Z",
      "ended_at": "2026-09-25T13:34:09.066Z"
    }
  ],
  "events": [
    "evt-exec-0001"
  ],
  "scene_id": "e6072cdd2e354163a5b3922058174f7f",
  "lease_id": "lease-0001-scene"
}
